{
  "$schema": "https://json-schema.org/draft/2020-12/schema",
  "type": "array",
  "items": {
    "type": "object",
    "properties": {
      "id": {
        "type": "string",
        "pattern": "^scenario:[a-z0-9]+(?:-[a-z0-9]+)*$"
      },
      "name": {
        "type": "string",
        "minLength": 1
      },
      "statCap": {
        "type": "integer",
        "minimum": 1,
        "maximum": 9007199254740991
      },
      "inheritanceTurns": {
        "type": "array",
        "items": {
          "type": "integer",
          "minimum": 1,
          "maximum": 9007199254740991
        }
      },
      "extra": {
        "type": "object",
        "propertyNames": {
          "type": "string"
        },
        "additionalProperties": {}
      }
    },
    "required": [
      "id",
      "name",
      "statCap",
      "inheritanceTurns"
    ],
    "additionalProperties": false
  }
}
